{
  "$schema": "http://json-schema.org/draft-07/schema#",
  "$id": "https://syrin.online/schemas/schema-drift-manifest.schema.json",
  "title": "SchemaDriftManifest",
  "description": "Per-browser or combined manifest emitted by scripts/schema-drift-view.sh. Consumed by CI (e2e-live-region-verify) and by --validate-manifest / --strict-manifest.",
  "type": "object",
  "additionalProperties": false,
  "required": [
    "browser",
    "browsers",
    "combined",
    "generatedAt",
    "type",
    "viewer",
    "resolvedViewerCommand",
    "matches",
    "excludes",
    "expected",
    "matched",
    "requiredArtifacts"
  ],
  "properties": {
    "browser": {
      "type": "string",
      "description": "Playwright project name, '<all>' when --browsers is unset, or 'combined' for aggregate manifests."
    },
    "browsers": {
      "type": "array",
      "items": { "type": "string" },
      "description": "All Playwright projects covered by this manifest."
    },
    "combined": {
      "type": "boolean",
      "description": "True for the aggregate --combined-manifest output."
    },
    "generatedAt": {
      "type": "string",
      "pattern": "^\\d{4}-\\d{2}-\\d{2}T\\d{2}:\\d{2}:\\d{2}Z$",
      "description": "UTC ISO-8601 timestamp (seconds precision)."
    },
    "type": {
      "type": "string",
      "enum": ["all", "types", "schemas"]
    },
    "viewer": {
      "type": "string",
      "enum": ["auto", "diff-y", "delta", "bat", "cat"]
    },
    "resolvedViewerCommand": {
      "type": "string",
      "minLength": 1,
      "description": "Human-readable form of the diff/viewer invocation."
    },
    "matches":  { "type": "array", "items": { "type": "string" } },
    "excludes": { "type": "array", "items": { "type": "string" } },
    "expected": { "type": "array", "items": { "type": "string" } },
    "matched":  { "type": "array", "items": { "type": "string" } },
    "requiredArtifacts": {
      "type": "array",
      "items": { "type": "string" },
      "description": "CI artifact filenames the downstream verify job must find per browser."
    }
  }
}
